{
  "id": "objectivec",
  "name": "Objective-C",
  "detect": {
    "files": ["*.m", "*.h", "Podfile", "Podfile.lock", "*.xcodeproj", "*.xcworkspace"],
    "dirs": ["Pods", "DerivedData"]
  },
  "rules": {
    "gitignore": [
      "build/", "DerivedData/", "*.pbxuser", "!default.pbxuser",
      "*.mode1v3", "!default.mode1v3", "*.mode2v3", "!default.mode2v3",
      "*.perspectivev3", "!default.perspectivev3", "xcuserdata/",
      "*.xccheckout", "*.moved-aside", "*.xcuserstate",
      "*.xcscmblueprint", "Pods/", ".build/", "*.ipa", "*.dSYM.zip", "*.dSYM"
    ],
    "vscode": { "files.exclude": { "DerivedData": true, "Pods": true } }
  }
}
